{
  "id": "event-0866-talibids-carried-off-to-samarra",
  "title": "The Talibids carried off to Samarra",
  "description": "The Talibids carried off to Samarra. Recorded under the year 252 AH (866–867 CE) in al-Tabari's History, volume 35.",
  "startDate": "0866-01-01",
  "category": "political",
  "connections": [
    "event-0837-ai-afshin-s-bringing-of-babak-and-his"
  ],
  "confidence": "auto-imported",
  "endDate": "0867-12-31",
  "location": {
    "latitude": 34.198,
    "longitude": 43.874,
    "name": "Samarra, Iraq"
  },
  "sources": [
    {
      "citation": "al-Tabari, The History of al-Tabari (SUNY), vol. 35",
      "page": "141"
    }
  ]
}