{
  "id": "event-0656-account-of-ali-b-abi-talib-s-advance",
  "title": "An Account of 'Ali b. Abi Talib's Advance toward al-Basrah",
  "description": "toward al-Basrah",
  "startDate": "0656-01-01",
  "category": "political",
  "connections": [
    "event-0656-ali-sets-up-camp-at-al-zawiyah-of",
    "event-0656-their-entry-into-al-basrah-and-the-battle"
  ],
  "confidence": "auto-imported",
  "endDate": "0657-12-31",
  "location": {
    "latitude": 30.5085,
    "longitude": 47.7836,
    "name": "Basra, Iraq"
  },
  "sources": [
    {
      "citation": "al-Tabari, The History of al-Tabari (SUNY), vol. 16",
      "page": "80"
    }
  ]
}