{
  "id": "event-0642-conquest-of-azerbaijan",
  "title": "The Conquest of Azerbaijan",
  "description": "The Conquest of Azerbaijan. Recorded under the year 21 AH (642–643 CE) in al-Tabari's History, volume 14.",
  "startDate": "0642-01-01",
  "category": "military",
  "connections": [],
  "confidence": "auto-imported",
  "endDate": "0643-12-31",
  "location": {
    "latitude": 37.8,
    "longitude": 46.3,
    "name": "Azerbaijan (NW Iran)"
  },
  "sources": [
    {
      "citation": "al-Tabari, The History of al-Tabari (SUNY), vol. 14",
      "page": "31"
    }
  ]
}