{
  "id": "event-0640-conquest-of-mi-r-and-alexandria",
  "title": "The Conquest of Mi$r and Alexandria",
  "description": "The Conquest of Mi$r and Alexandria. Recorded under the year 19 AH (640 CE) in al-Tabari's History, volume 13.",
  "startDate": "0640-01-01",
  "category": "military",
  "connections": [],
  "confidence": "auto-imported",
  "location": {
    "latitude": 31.2,
    "longitude": 29.92,
    "name": "Alexandria, Egypt"
  },
  "sources": [
    {
      "citation": "al-Tabari, The History of al-Tabari (SUNY), vol. 13",
      "page": "163"
    }
  ]
}