{
  "id": "event-0638-construction-of-kufa",
  "title": "Construction of Kufa",
  "description": "Founding of Kufa as a military camp and later major Islamic city in Iraq",
  "startDate": "0638-01-01",
  "endDate": "0638-12-31",
  "location": {
    "latitude": 32.0333,
    "longitude": 47.7167,
    "name": "Kufa, Iraq"
  },
  "category": "cultural",
  "connections": [
    "event-0636-battle-of-al-qadisiyyah",
    "event-0656-first-fitna"
  ],
  "learningPath": "early-islamic-period",
  "dynasty": "Rashidun",
  "region": "Mesopotamia",
  "media": []
}
